comment,author,date,num_likes
싸튀충 남성들이 장가 갈때 의무기록을 반드시 고지하도록 법이 제정되어야합니다,린트프,2022-10-14T16:30:45Z,9
저 어린나이에 감당못할 어려움인데..큰일이네,다뚱,2022-10-12T16:46:16Z,1
예빈맘~ 자책 하지마요 부모가 둘다있던없던 잘살던 못살던 아이가 느릴수있고 조금다를수있어요 그리고 너무 힘든상황에서 어떻게 엄마가 밝아야 하고 즐거워해야하나요<br>엄마도 사람이예요 저라도 그랬을꺼같아요 <br>저보다 더 대단한걸요 ~,목기롱,2022-10-12T16:38:32Z,9
가연맘에게 도움을 주고싶은데 방법이 없을까요 ?,딸2,2022-10-12T16:10:46Z,4
동화책 종 보내주려면 어떻게해야할까요,김다정,2022-10-12T15:47:47Z,1
"아이의 엄마는 0점으로 시작하지 않아요. 엄마라는 이유로 100점부터 시작하는게 아이와 나의 셈이랍니다. 예빈이는 엄마가 100점 그 이상일테니, 엄마도 엄마의 삶을 조금씩 찾아나갈 수 있다는 기대와 희망을 가져보면서 예빈이의 행복한 우주가 되어주세요.",별동,2022-10-12T15:19:09Z,4
힘내요. 괜찮아요 느리면 뭐 어때요 가연님에겐 특별한 아이라서 더 소중한데요<br>기죽지말고 예빈이랑 행복하게만 살면 그것보다 더 좋은건 없어요~ 응원할게요 가연님😊,유 츠,2022-10-12T15:19:02Z,3
아빠한테 어렸을때부터 우울증 불면증 걸리기 전(고등학교 입학전까지) 아동학대를 당한것땜에 어렸을때는 말이 느려서 엄마랑 기본 1시간 이상 거리에 있는 언어발달 치료센터에서 여러번 치료 받았으며 유치원 1년 더 다니며 01년 동생들이랑 초등학교를 입학하며 다른 친구들보다 습득력이 느려서 엄청 노력을 했고 지금은 23살 성인이 된 여자로 성장했습니다 예빈이도 조기에 치료 잘 받으면 저보다 훨씬 더 성장 잘할거예요,비비지,2022-10-12T15:06:26Z,10
저도 4살 딸아이 키우는 엄마지만 자기전에만 되면 아이한테 못해준것만 생각나서 자책으로 늘 괴로웠어요.. 그렇지만 현재 상황에서 엄마들은 늘 최선을 다하고있고 할 수 있는거 하고있다고 앞으로 더 잘하자고 생각중이에요 정말 엄마가 못하고 있는게 아니에요 나중에 예빈이가 고마워할거에요,까꽁비,2022-10-12T14:51:57Z,8
동사무소에가면 언어치료 국가에서 지원해주는게 있어요..<br>여러 복지가  있으니 동사무소 방문하셔서 여럿  알아보셔요..,오늘의 밥상(table of today),2022-10-12T14:45:35Z,2
"예빈이에게 최고의 엄마, 마음의 짐을 덜고, 미안함을 덜고, 희망을 얻고 힘내시길 응원합니다..❤",박소희,2022-10-12T14:45:18Z,32
예빈이 얼집은 안가나여?,토깽토깽,2022-10-12T14:42:08Z,0
아흑 ㅠㅠ,사랑해 딸 TV,2022-10-12T14:39:41Z,0
제가 일하는 어린이집에 자폐증 원아가 있어요. 예빈이와 비슷해요. 예빈이는 가연씨 잘못이 아니라고 말해주고 싶어요.,sujin park,2022-10-12T14:38:13Z,3
예빈이랑 같은 나이 아이를 키우는데..<br>어린나이에 정말 최선을 다하네요ㅠㅠ<br>좋은날이 오기를 ..힘내세여,이수정,2022-10-12T14:37:13Z,4
예빈씨...울지마요. 잘하고 있어요..토닥토닥,다이나마이트love,2022-10-12T14:34:41Z,23
힘든 만큼 행복해 질 것입니다😊<br>예빈이도 귀엽네요😊<br>저도 외국에서 30년 동안 혼자 살아요.<br>딸아이가 올해 20 이 되었어요<br>딸아이 덕분에 강해졌습니다😊<br>지켜내야 했으니깐요😊<br>지금 생각해 보면<br>아무리 어렵고 아무리 힘들어도 모두 지나갑니다.<br>세상에서 둘 뿐입니다😊<br>어머니가 더 강해지 하겠죠<br>앞으로는 꽃길만 걸으세요<br>행복하게 아름답게<br>유일하게 지켜 줄 수 있는 거는 엄마라는 보호자일 뿐입니다😊<br>20 년이란 세월이 금세 지나갔습니다😊<br>20년 전에 그렇게 힘들었었는데<br>지금 가끔 따라이랑 얘기하면서<br>웃고 지나가죠<br>비 온 뒤에 땅이 단단해지듯이<br>사람도 같습니다😊<br>화이팅 하십시오👍,蓮姫 金,2022-10-12T14:18:48Z,16
엄마니깐 다시한번 더 힘내세요.응원합니다,LIANSHI LI,2022-10-12T14:16:56Z,1
언어가 느린 아이들의 특징이 반향어에요..다른 영상들보면 자폐는 아닌거같은데..저희아이도 자폐의심 받다 <br>Adhd..오히려 저희 아이보다 모든면에서 더 빠릅니다.동사무소 가셔서 바우처 알아보세요..엄마가 강해지셔야 합니다.<br>힘내세요!,꼬밍몽,2022-10-12T14:13:05Z,22
엄마로서 일도 하고 공부도 하고 운동도 하고 좀 스스로 강해져야겠어요<br>남자 없어도 부모 없어도 엄마니까 잘 사는 모습 보여줘야죠. 악착같이 살아내요.그렇게 사는 사람 많아요.,전실장,2022-10-12T14:01:14Z,1
얼마나 힘들지....마음이 아파요ㅠㅠ,미돌,2022-10-12T13:46:24Z,3
지금까지 본거중에 제일 안아주고 싶은 <br>엄마네요~보는데 눈물이...<br>예빈이 엄마부터 밥잘먹고 <br>상담 잘 받으시고 씩씩해지세요<br>그래야 예빈이한테도 그애너지가 팍팍<br>힘내세요~♡,EJ,2022-10-12T13:45:14Z,253
어린 맘인데도 되게 의젓하고 요즘 사람같지 않게 엄마로서 부족함이 없는 엄마의 모습을 봐서 대견하다. 잘하고 있다고 말해주고 싶다. 분명 아이도 느끼고 있을거에요. 쓰담쓰담 토닥토닥 가연님 응원합니다.,수진찡,2022-10-12T13:44:30Z,66
제가 두 딸 키워본 경험으로 예쁜옷 입혀서 나가면 정말 많은 사람들이 예쁘다 칭찬 해주시고 말 많이 시켜 주시더라구요..관심 받는거 좋아하는 예빈이도 분명 좋아할꺼예요💕,최딸기,2022-10-12T13:37:00Z,24
애아빠놈 존나 더 얄밉다진짜 양육비 반드시...,이민선,2022-10-12T13:35:29Z,9
얼마나 힘들까...너무 예쁘게 육아하는 모습보고 응원해주고 싶었어요. 힘내세요!,kuiamang,2022-10-12T13:33:25Z,20
왜 그 쓰레기놈을 못잊어서ㅜㅜ<br>안쓰럽네요,최은진,2022-10-12T13:27:02Z,1
힘내세요 ~ 저두 아들  혼자키워바서  눈물이  나네여,진희김,2022-10-12T13:25:07Z,3
괜찮아요<br>초등학교들어가서도 말 잘못하는아이들많아요<br>나중에 똑 같아지더라고요,이상희,2022-10-12T13:25:04Z,0
자폐랑 단순언어지연이랑은 달라요,jk h,2022-10-12T15:02:42Z,2
힘내세요,웃음바이러스 김민주둥이,2022-10-12T13:17:25Z,1
지역행정센터에 찾아보면 치료 지원 받을 수 있어요. 아이 치료가 잘 되길 바라요…,Reese,2022-10-12T13:14:06Z,2
너무 걱정말아요 ᆢ 애쓰고 노력하는 모습이 애잔하고 너무 예뻐요ᆢ 잘클수있어요 ᆢ늦는애들도 있구요ᆢ지금힘들겠지만 아이가 삶의 원동력이되고 기쁨이될거에요ᆢ 자체만으로 진짜 멋진 엄마에요ᆢ잘될거에요,정유희,2022-10-12T13:03:34Z,2
딱하다 ㅠㅠ 무력감이 괜히 온게 아닌데 기댈곳없이 버텨오다 무너지네 <br>힘내요 예빈맘 가연씨 화이팅,비타지연2,2022-10-12T13:00:37Z,19
"안녕하세요 현재 언어치료사로 일하고 있는 시청자입니다. <br><br>먼저 나라에서 지원하는 바우처 사업들이 여러가지 있습니다. <br><br>지역에 따라 차이가 있기는 하지만 먼저 동사무소(주민센터)에 전화하셔서 지원하실 수 있는 바우처가 있는지 확인해보시면 좋을 거 같습니다. <br>보통, 발달바우처와 지역사회바우처 크게 2가지로 받을 수 있을 거 같은데 발달바우처와 지역사회바우처 모두 소득분위에 따라서 지원금이 다를 수 있다는 점 알고 계셔주시면 될 거 같습니다.<br>(이 두 바우처를 동시에는 받을 수 없어, 두 개 중 하나만 신청 가능할 것입니다)",미피월드,2022-10-12T12:57:25Z,7
본방보고  많이울었네요<br>아이충분히  고칠수있을것같구요<br>엄마도  힘내세요~,shh,2022-10-12T12:57:11Z,13
힘내라 잘할수있어 넌 무궁무진한 힘이있어 응원할께,이혜,2022-10-12T12:56:52Z,1
힘내세요~지금 너무 잘하고있어요~,어여뻐소서그대,2022-10-12T12:55:52Z,3
안녕하세요 치료해야 계속해서 받았으면 좋겠네요목포명도어린이집,김우정,2022-10-12T12:39:50Z,0
자페아니에요 발달이느린것뿐이에요<br>대근육소근육다좋아요.<br>책마니읽어주고 엄마직장분들이랑얼른친해져서 아이랑같이 만나면서 서로주고받는대화듣는것도아이한테중요하고 계속듣다보면 말잘트일거에요<br>표현을저렇게잘하고 잘웃고<br>걱정하지마세요.<br>엄마가얼른치료가시급한것같아요.치료꼭받으세요,볼빨간방수니,2022-10-12T12:37:11Z,49
꼭 힘내세요!,미경 김,2022-10-12T12:34:07Z,1
영상보면서 맘이 너무 아파서 눈물 많이 흘렸어요 가빈씨 너무 어려서 조언구할 분들도 안계시고 어른들이 어른답지 못하고 어른들 잘못이예요 아버지도 시어머니도 가연씨 입장에서 조언해주시는분들이 없고 얼마나 외로웠을지~~ 가연씨 책임감하나로 예빈이 키우시는거 같아요<br>용기내셔요 응원할께요,지윤정,2022-10-12T12:32:59Z,169
4년넘게다니고 사회생활 할수 있게 사람들하고 인사도하고 말도 하게 일부러 시켰어요 예빈이도 발달이 느리고 힘들어도 엄마니깐 힘내세요 옆에서 같이 성장하는게 힘들지만 엄마니깐 힘내수 있어요 화이팅,박혜민,2022-10-12T12:26:44Z,3
진짜 그 마음 조금이라도 압니다. 독박육아에 만나는사람  없고 고독하다못해 적막함... 만성우울에 무기력에 만성피로.. 그래서 정신과도 좋지만 얘를 어린이집으로 보내는게 건강할듯해서보내고 사회생활했어요. 머리쓰는일 말고 몸쓰는일 ㅎㅎ 땀내고싶더라구요! 힘내십쇼!,Say Korea,2022-10-12T12:25:51Z,20
저도요.  우울할땐 정신없이 몰두할수 있는 일 하는게 좋은거같아요.,김예진,2022-10-13T08:49:56Z,1
네.. 맞아요 .ㅜㅜ,마미도연,2022-10-12T14:33:01Z,0
저는애기가태어날때부터 병을 조금 가져서 태어났어요 큰병은 아니지만 우리아이도 예빈이 보다 더늦게 말하고 느렸어요 약간의 차이도 있고 애들 성향이 틀리고 하지만 엄마의 노럭이 많이 필요해요 저두 우리애한테 수다쟁이가 됐어요 어떻게서든 언어치료만,박혜민,2022-10-12T12:24:16Z,1
건강한아이도키우기힘든데...,우성 싯,2022-10-12T12:12:34Z,0
발달재활바우처 받으셔서 언어치료 주1회라도 받으세요 <br>혹 아이 보험이 있다면  실비센터 알아보세요 <br>80프로 환급받으니 보통치료비가  실비센터는 <br>8만원이거든요  자부담이16000원꼴 나오거든요.   성향이 보이기는 하는데 <br>아직 어리니 코드를 r 발달지연으로 받으면 가능할꺼예요 우선 알아보세요<br>혹 보험이 없다면 고지의무가 있어서 <br>가입은 쉽지않을꺼 같아요<br>영유아검진 기록이 있어서요,박은경,2022-10-12T12:10:24Z,3
혹시친정  엄마계시면   엄마한데  달려보세요ㅡ그래도  여자는 아이낳고 보면  엄마생각이 많이나요 ㅡ힘내시고   행복하세요,우리가족  건강  최고♡,2022-10-12T12:06:17Z,0
옆에있음  많이챙겨주고  보담아주고싶네요...얘가 애기를키우느라 얼마나힘들꼬..가여워라..,매력,2022-10-12T12:03:30Z,58
주민센터에 가면 아동발달바우처라고 해서 발달지연인 아이들에게 국가에서 금액을 지원해주는 것이 있어요. 소아과 의사의 소견서 등이 필요한데 일단 주민센터에서 자세한 설명을 듣고 필요한 서류를 받아서 신청하면 소득에 따라 개인부담금이 결정되는 아주 좋은 제도에요. 만6세 생일전까지 받을 수 있고 그 이후에는 장애등급을 받은 아이들이 18세까지 지원받을 수 있다고 하는데 꼭 잘 알아보아서 이런 혜택을 받았으면 좋겠네요,여행 읽어주는 여자,2022-10-12T12:01:47Z,141
후원 노리고 나왔구먼,jane,2022-10-12T12:01:30Z,2
이 프로그램에서 센터 에대한  내용과 비용에 나와서 전 정말 행복합니다<br>실질적으로 발달 지연 과 발달 장애 으로 <br>센터를 다니는 아이들이 굉장 히 많아요<br>하지만 1회 40분 5만원에서 6만원까지 갑니다 <br>그런데 언어 치료 주1회 ?<br>소용 없습니다 <br>적어도 주 3회는 다녀야하는데<br>한달에 4주 라고 하고  주3회입니다 <br>그럼 총 12회 그리고 가격이 <br>회당 5만원 이라 고 하면<br>60만원 정도 입니다<br>센터 비용 조정 과  각 시 자체에서 지원을 해야 한다고 생각합니다,박소희,2022-10-12T11:59:27Z,9
임신때 시월드에서 스트레스 받아서 애기가 이상증상이 생긴거같네ㅜㅜ 머하러 그런사람을 만나서 어린나이에 고생이 많아요ㅜㅜ...,미소,2022-10-12T11:55:01Z,12
예빈이 어머니.<br>힘내시고 기운내세요♡,샛별,2022-10-12T11:48:51Z,7
정말 행복한일만 생겼으면좋겠어요.<br>우울증은 진짜 힘든건데.<br>잘이겨낼수있으면좋겠어요.,우엉,2022-10-12T11:25:54Z,9
제가 보기엔 자폐는 아닙니다.<br>그러니 힘내세요..,Odri햇반,2022-10-12T11:22:36Z,11
@코코리스 게임 모니터링하는 사람들은 게임의 관심이 전혀없는걸로 보아 제말의 의미랑 같다고 생각합니다 그러므로 누구나 전문가 될수 있다고 생각합니다,ㄱ,2022-10-15T05:10:18Z,0
@ㄱ 어떤 분야를 연구하거나 그 일에 종사하여 그 분야에 상당한 지식과 경험을 가진 사람이 전문가지요 그 분은 다른 의미로 한 말씀이 아닐까요?,코코리스,2022-10-15T02:38:38Z,0
@jk h 김규철 위원장께서 말씀으로는 딱히 전공아니라도 전문가 될수있다고 말했어요,ㄱ,2022-10-14T17:59:54Z,0
@ㄱ 당연히 전공 공부해야 전문가죠.,jk h,2022-10-14T13:06:55Z,3
@jk h 꼭 전공 공부해야 전문가인가요?,ㄱ,2022-10-14T12:59:15Z,0
엄마가 무기력한데 아이가 밝을수는 없죠<br>아이도 엄마 모습을 보고 자라는건데<br>지금이라도 극복하려고 노력해야 해요<br>우울증 치료도 받고 엄마가 건강해졌으면 좋겠어요,지은 이,2022-10-12T11:22:00Z,29
예빈이 엄마~ 너무 잘 하고있어요~♡,박진숙,2022-10-12T11:18:06Z,7
꼭 좋은날이 오기를 바랍니다🙏🏻,패션마녀,2022-10-12T11:18:04Z,2
고딩엄빠 보고 처음으로 움ㅠㅠ <br>힘내세요 가연씨!! 앞으로 꽃길만 걷길,rg te,2022-10-12T10:54:17Z,12
"우리 큰아이도 어려서 발음도 안좋고 말도 더뎌 언어치료 받았어요.치료 받아도 어느정도 한계가 있다고 진단받았죠.학교 진도 따라가기 힘들어하고 친구 사귀기도 힘들어했지만 서른이 된 지금 4년차 소아과 간호조무사로 어엿한 사회인이에요.가연씨 지금은 힘들겠지만 조금만 더 힘내세요,언젠가 예빈이도 우리아이처럼 가연씨에게 좋은 친구가 되줄만큼 성장할거에요.",정숙,2022-10-12T10:52:52Z,147
간호조무사면 하꼬직업 아닌가요?,오아오어오으,2022-11-21T14:51:16Z,0
엄마가 밝아지고 즐거워지면 예빈이도 밝아지고 즐거워질거예요. <br>차근차근 앞으로 나아가면 될거예요!!힘내요!!,낭만공주,2022-10-12T10:51:29Z,18
임신 때 출산 후 스트레스 너무 받아서 그래,안전랩쳐,2022-10-12T10:40:36Z,4
"유아특수교사인데요.  사실 이 영상 말고 다른 일반적인 예빈이 영상보면서 발달장애 및 자폐아 의심이 보였습니다. 병원이 아니라 검사센터에서 저렇게 객관적으로 말씀해주시가 쉽지 않거든요. 지금은 서운하시게 들리셔도 현실을 보고 조기진단과 치료가 가장 중요합니다. 하지만 경제적인게 가장 걱정이실텐데.. 성장중인 아이들은 장애진단이 쉽지 않아요. 하지만 특수교육대상자로 주민센터와 알아보시고, 바우처를 함께 사용하시면 치료비가 많이 경감됩니다. 그리고 아이를 혼자 부담하기 보다 관련 유아교육기관(통합어린이집 또는 통합유치원)으로 자리를 알아보시고 가능한 또래들과 많이 어울리게 해주시길 부탁드려요!!",감동하루,2022-10-12T10:29:18Z,914
@ᄏᄏᄏᄏ 안 읽어주는 것보다 도움이 되죠. 그런데..이 보다 더 중요한 것은 말을 시키고 기다리는 겁니다. 그리고 아이가 필요한 말이 있을 때 부모가 말하지 않고 기다리는 겁니다. 본인이 답답해서 말을 할 수 있도록 유도하는 게 가장 좋아요. 손가락으로 포인팅하면 &quot;~줄까?&quot;이게 아니라.. &quot;뭐 필요해?&quot;로 말해서 사물을 말할 수 있도록..그리고 사물을 말하는 수준이 되면 단문장을 만들 수 있도록 유도하구요. 영어대화를 잘 하는 사람이 독해를 잘하는 사람과 일맥상통하지 않은 것처럼 그래요~,감동하루,2022-12-08T12:39:27Z,0
궁금한게있는데말이느린아이한테책을많이읽어주면말이조금씩트이나요??,ᄏᄏᄏᄏ,2022-12-08T12:34:03Z,0
저도 그렇게 생각했어요 제가 전문가는 아니지만 오늘 고딩엄빠2 재방으로 예빈이 봤는데 행동하는거 보면 확실히 <br>자폐스펙트럼인것 같았어요.. 그래도 아니길 바랬는데ㅠㅠㅠㅠ,뭣허냐옹,2022-11-04T15:08:17Z,0
@신연아 맞아요 아닐수도있어요 다들이론적으로보는거같음 다들오영은 박사인가 <br>결혼지옥12회  발달장애검사받으러간 장면이있었는데 거기에서는맞다고하는데 오영은박사님은 아니고 엄마의무기능함때문에 그런다고했어요,조은실,2022-10-25T17:33:03Z,2
아닐수도 님들이 의사가아니잖아요  결혼지옥에서 12회였나 검사받으러가는데  검사센터에서는 맞다고했는데 오영은박사님은 아니라고 했거든요 왜티비만보고 이론적으로 생각하세요,조은실,2022-10-25T17:17:31Z,1
그냥 보여주고 끝이 아니라 체계적으로 도움을 주는 프로그램이었으면 합니다..,MY so,2022-10-12T10:24:48Z,67
이거죠. 단순 시청률 때문이 아닌 기관 연계도 함께 해주었으면 더욱 좋겠습니다.,선택의 길,2022-10-12T23:36:51Z,6
ㅁㆍㅂ,지은 배,2022-10-12T13:51:02Z,0
예빈이 엄마힘내세요<br>응원합니다,이점순,2022-10-12T10:15:29Z,12
"가연씨가 한번도 소리내어 울지 않는게, 그만큼 꾹꾹 속으로만 쌓고있는것같아 더 안쓰럽네요",HANAH,2022-10-12T10:14:33Z,47
엄마가 못해서 그런거아니니까 자책하지말았으면,김주은,2022-10-12T10:12:05Z,15
진짜 답답스다 피임을 잘해야지 이 고삐리들아 <br>이프로 취지가 므냐<br>사고친거 꼴비기 싫지먀 방송 나오게 했으면<br>살게끔 도움 주든지,고고아님쓰,2022-10-12T10:07:14Z,10
한번 꽉 안아주고싶다.. 안쓰럽고 대견하다고 이야기 해주고싶어.,보리데이 Bori Day,2022-10-12T09:58:34Z,11
;;; 사물에 관심 많은거 보면 자폐는 아닌거 같은데ㅜ 병원가서 의사에게 가보세요,장데레사,2022-10-12T09:50:12Z,5
@인투코리아INTOKOREA 맞아요 자폐라도 다 다름이 있다고 들었어요,마미도연,2022-10-12T14:36:12Z,0
답답하네 참 에휴..,효린,2022-10-12T09:39:28Z,5
엄마의 무기력함 이해해요.. 내 힘으로 어쩌지 못하는 벽을 만날 때 오는 그 무기력.. 경험해보지 못한 사람은 몰라요.. 죄책감 갖지마세요 낙태율이 심각한 이 시대 아이를 지켜낸 것만으로도 훌륭한 엄마에요 <br>예빈엄마와 인연이 닿아 정말 좋은 친구가 되어주고 싶어요 <br>고난 중에 성장할 예빈엄마를 응원합니다♥,citra,2022-10-12T09:36:03Z,359
응원합니다~,Judy,2022-10-24T19:35:14Z,1
읽는 분들에게 큰 힘 되실거에요~♡!<br>엄마들 만세~!♡,한줄책방,2022-10-15T13:51:57Z,3
님 댓글에 너무 공감이 가서 눈물이 다 납니다...저도 한때는 엄청 무기력했었거든요...경험하고 나니 알겠더라구요...지금은 많이 단단해지고 씩씩하게 지내고 있어요...예빈 엄마 이왕 이렇게 노출이 되었으니 많은 도움과 사랑으로 잘 이겨나갔으면 좋겠네요^^,ME,2022-10-13T04:20:21Z,18
가연님 힘 내세요<br>세상에 어찌할수 없는 상황에서도 예빈이 잘 키웠어요,오금록 시인의 방,2022-10-12T09:13:59Z,22
가장 중요한건 아이를 책임졌잖아요~<br>힘내요~  행복하세요~,,2022-10-12T09:03:28Z,57
예빈이 엄마 꼭 안아주고싶네요 ㅜㅜ <br>행복한 앞날을 응원합니다,민들레 김,2022-10-12T09:02:43Z,42
저기좀 잘모르는곳인거같아요 예빈이는 자폐전혀아닌거같은데눈맞춤도잘되고 또래애랑 잘노는거같은데요 전 저희아이걱정되서 소아정신과갔었는데 보는관점이 저분이랑 완전다르더라구요 전문의만나보셔요<br><br>자폐인아이들은 자기가잘했다고 주변에시선을주면서 칭찬해달라고하지않는다고합니다<br><br>좀더전문가에게 검진받으세요 센터가시지말고 <br>저희애랑많이비슷하네요,buffaloub11,2022-10-12T09:00:19Z,23
자폐가 의심된다고 했지 진단하지는 않았는데요... 대수롭지않게 넘겨서 시기 놓치는 것보다 꼼꼼히 지켜보고 예방하고 치료하는게 낫죠,불주먹,2022-10-12T16:03:38Z,6
이전 영상 반향어 부터 자폐스펙트럼인거 같았는데요ㅠㅠ저또한 아이 언어치료 놀이치료 여러군데다녀봤지만 영상에나오는 분들이 잘모르는사람은전혀아니고 전문의 맞아요,권미진,2022-10-12T15:56:47Z,5
자폐스펙트럼이라고하잔아요 여러가지 증상들이 광범위해요..,Sy kim,2022-10-12T12:31:44Z,12
엄마도 기댈곳이 필요한것같아요.<br>아직 어린데..ㅠㅠ,FUNNY&GOLF,2022-10-12T08:47:33Z,30
예빈이는<br>엄마랑 케이크 먹으며 소통<br>하잖아요. 놀이터에서 만난<br>동생아이와도 같이 놀고<br>반응하고요.<br>자극만 잘주면 분명 똑똑한<br>아이로 성장할 겁니다.^^<br> 아이를 사랑하는 마음이면<br>이미 훌륭맘 .충분합니다. ~^^<br>힘내세요~~,박정미,2022-10-12T08:43:20Z,234
힘내세요 가연씨,손연희,2022-10-12T08:42:44Z,2
진짜 양육비는 필수로 와닿네요,구름,2022-10-12T08:31:09Z,24
그렇지 않아도 힘든 상황에 아이까지 ... 아직 어리니까 잘 헤쳐나가실 수 있을거예요,뀨뀨♡,2022-10-12T08:24:48Z,4
스트래스 많이 받아서 그런것 같아요,이은희,2022-10-12T08:01:17Z,5
가연씨 힘내요~ 충분히 훌륭한 엄마랍니다~영상 보면서 울컥했네요~ 사랑스런 예빈이와 오래오래 행복한 삶을 살아가기를 축복해요~,허하영,2022-10-12T07:52:43Z,133
@ㅇㅇ 지금 어른인데요 글고 교육 수준이 슬럼가 의미가 없음 인성교육 시키는것도 아니고 글고 정치인들은 세금만 빨아먹을수 있으면 신경안씀 서민들이 괴롭거나 나라 망하는거대해 아무런 관심도 없음 그래서 출산하라고 하는거임,ㄱ,2022-10-14T13:03:16Z,0
@ㅇㅇ 미성년자 출산을 동의하는건 아닙니다<br>이미 벌어진 일이니 생명은 귀한 것이니 국가와 이웃이 함께 관심을 가져야한다고 생각합니다<br>미성년자 부모일지라도 자기 자식 포기하지 않고 책임지는  자세가 훌륭하다고 봅니다<br>책임 회피하는 어른들도 많으니까요,허하영,2022-10-14T05:15:35Z,0
애가 애를 키우는게 어디쉽겠어~,댕댕투어,2022-10-12T07:37:41Z,4
"예빈이 엄마 이 글을 본다면 꼭 마음공부 하시고 모든건 완벽할 수 없어요 천천히 하면되요, 엄마가 밝아야 아이도 자신감 생겨요 할 수있어요 모든건 내우주입니다",더문,2022-10-12T07:26:50Z,8
상담  선생님  말이  감동이네요<br>가연씨  힘내요  다  잘될거예요,달달구리,2022-10-12T07:10:11Z,50
엄마도 누군가가 필요한거 같은데ㅜㅜ,박은희,2022-10-12T06:58:23Z,15
저도 만성우울때문에 정신과약 먹는데 약먹기전후 마음이 편한게 다르긴해요 치료랑 약 꾸준히 유지하시고 예빈이랑 행복하게 지내세요 화이팅,이마,2022-10-12T06:50:36Z,34
너무안타깝다... 양육비 꼭 다 받아내서 치료하자!!!!<br>이영상 보기 전영상부터 <br>예빈이의 행동 말투  말따라하기 <br>영상으로 지켜봤는데<br> 발달장애 그리고 자폐 까지 있는거 같다 생각은 했었는데 .. 진짜네  안타깝다..ㅠ<br>앞으로 다 잘되시기를 마음으로 응원합니다 힘내세요<br>후원하고싶은데 방법없나요?<br>원래 이런생각 잘안드는데 너무짠하네..,일론 머스크,2022-10-12T06:48:37Z,35
상담 선생님 진짜 좋으신 분,yoonsoo,2022-10-12T06:46:00Z,136
아이고 눈물나..모든 한순간의 실수로 이렇게 된거지..나두 그래요..실수. 잘못된 만남.  선택으로 아이까지 ...,yoonsoo,2022-10-12T06:41:57Z,18
가연씨 너무 자랑스러워요 💕,chi hinman,2022-10-12T06:40:10Z,23
